301_0;organ intern crimin activ
301_1;intern crimin organ
301_2;intern organ crime
301_3;intern crime group
301_4;intern drug trade crime group south america
301_5;intern smuggl group
301_6;intern crimin organ
301_7;intern illeg drug trade organ countri
301_8;intern terrorist group illeg activ countri
301_9;intern organ benefit crime countri
302_0;polio incid
302_1;polio preval
302_2;polio outbreak health
302_3;recent polio outbreak
302_4;polio outbreak
302_5;polio treatment post polio problem
302_6;impact poliomyel public health
302_7;poliomyel control
302_8;polio outbreak timelin event
302_9;polio erad post polio problem solut
303_0;hubbl telescop accomplish
303_1;hubbl telescop achiev
303_2;hubbl telescop
303_3;hubbl telescop research studi
303_4;hubbl telescop new find
303_5;impact hubbl telescop space imag
303_6;posit hubbl telescop accomplish
303_7;hubbl telescop increas human knowledg
303_8;hubbl telescop phenomena prove fals hypothesi
303_9;hubbl telescop benefit repair
304_0;endang mammal habitat threat
304_1;endang mammal
304_2;list endang mammal
304_3;endang mammal habitat
304_4;popul endang mammal
304_5;name endang mammal
304_6;environment chang endang mammal
304_7;endang mammal habitat
304_8;endang mammal threaten habitat loss deforest human activ
304_9;endang mammal threaten climat chang global warm habitat unfit
305_0;crashworthi vehicl
305_1;vehicl safeti
305_2;car fewest crash
305_3;passeng vehicl crashworthi
305_4;crashworthi passeng car
305_5;least crashworthi passeng car
305_6;crash test report passeng car vehicl
305_7;best worst car safeti
305_8;car make model like kill passeng
305_9;car make model likeli fatal accid
306_0;africa civilian death
306_1;civilian casualti african civil war
306_2;africa civil war civilian casualti
306_3;civil war africa civilian casualti
306_4;arm conflict africa civilian casualti
306_5;civilian kill civil war africa kill count death toll
306_6;number unarm pedestrian kill african civil war death toll
306_7;number innoc bystand kill african civil war death toll
306_8;count dead civilian non combat bystand african civil war death toll
306_9;innoc bystand casualti african civil war death toll
307_0;hydroelectr power
307_1;hydroelectr project
307_2;plan hydroelectr project
307_3;propos hydroelectr project
307_4;hydroelectr construct
307_5;hydroelectr construct locat
307_6;hydroelectr construct countri
307_7;hydroelectr construct problem
307_8;hydroelectr project construct locat natur extent purpos problem consequ
307_9;hydroelectr project construct countri locat
308_0;tooth implant advantag disadvantag
308_1;tooth implant
308_2;tooth implant advantag disadvantag
308_3;tooth implant side effect
308_4;pro con tooth implant
308_5;clinic research tooth implant
308_6;disadvantag tooth implant
308_7;tooth implant plu minu
308_8;tooth implant increas durabl strength
308_9;tooth implant disadvantag cost mainten
309_0;rap music bad
309_1;neg effect rap music
309_2;rap music suck
309_3;neg effect rap music
309_4;evid rap music consequ teenag
309_5;relat rap music lyric suicid tendenc
309_6;rap music neg influenc young peopl
309_7;rap music neg effect young peopl
309_8;rap music link increas illeg drug usag teenag studi
309_9;rap music teenag percept women alter studi
310_0;radio wave brain cancer
310_1;mobil phone brain cancer
310_2;brain cancer occurr radio wave
310_3;radio wave brain cancer evid
310_4;radio wave brain cancer studi
310_5;mobil phone radio wave brain cancer
310_6;brain cancer radio wave mobil phone
310_7;associ brain cancer radio frequenc
310_8;preval brain cancer studi radio tower
310_9;brain cancer caus use mobil phone
311_0;theft trade secret
311_1;stolen trade secret
311_2;trade secret theft espionag
311_3;trade secret theft
311_4;theft trade secret
311_5;trade secret leak fashion industri design
311_6;pharmaceut compani incur theft trade secret
311_7;freedom inform act use steal trade secret
311_8;theft trade secret silicon valley
311_9;trade secret theft exampl
312_0;grow plant in water
312_1;plant growth without soil
312_2;scienc grow plant water
312_3;grow plant water
312_4;scienc hydropon
312_5;advantag hydropon instal rate plant develop
312_6;hydropon instal cost benefit analysi
312_7;nutrit plant instal hydropon setup
312_8;plant growth hydropon
312_9;hydropon nutrient plant grow artifici organ agricultur sustain
313_0;magnet levit
313_1;magnet levit commerci use
313_2;commerci use magnet levit
313_3;commerci use magnet levit
313_4;magnet levit commerci use
313_5;magnet levit transport train transit
313_6;magnet levit transport train transit govern plan
313_7;maglev flywheel applic car automobil
313_8;maglev superconduct
313_9;magnet levit transport train transit fastest train world
314_0;marin veget commerci
314_1;marin veget harvest
314_2;alga seawe kelp food drug
314_3;seawe alga kelp food drug
314_4;commerci harvest marin veget
314_5;commerci harvest marin veget
314_6;harvest alga seawe kelp food commerci farm
314_7;marin plant harvest commerci econom gain food
314_8;marin plant harvest pharmaceut compani alga seawe kelp coral
314_9;ocean plant harvest farm seawe coral kelp alga drug food
315_0;mysteri fatal highway accid
315_1;highway fatal unknown caus
315_2;fatal highway accid
315_3;unresolv fatal highway year
315_4;fatal highway accid reason determin
315_5;unknown caus fatal highway accid
315_6;caus highway accid determin
315_7;unsur driver caus highway accid
315_8;fatal highway accid undetermin caus
315_9;fatal highway accid unknown caus mysteri death crash
316_0;polygami
316_1;polygami
316_2;world polygami
316_3;polygami polygyni polyandri world today
316_4;polygam relationship cultur worldwid recent year
316_5;social attitud share multipl husband wife polygami
316_6;custom cultur social belief polygami
316_7;welfar polygam relationship child care hous
316_8;love secur polygam relationship cultur normal
316_9;polygami polyandri polygyni common polygam reason caus root origin preval
317_0;junk fax fcc effect
317_1;junk fax law
317_2;effect fcc ban junk facsimil
317_3;fcc junk fax facsimil regul pass
317_4;fax facsimil regul ban junk pass yet fcc
317_5;fcc regul ban junk fax facsimil pass
317_6;fcc ban fax facsimil effect
317_7;unsolicit junk fax facsimil invas privaci
317_8;cost ink printer mainten junk facsimil individu busi
317_9;fcc ban junk fax
318_0;us retire expat
318_1;best place retir outsid usa
318_2;best countri retire
318_3;best live condit qualiti life outsid america
318_4;best place live retir outsid us unit state
318_5;best qualiti life retir outsid us unit state
318_6;retir europ us unit state expat
318_7;retir africa us unit state expat
318_8;retir asia us unit state expat
318_9;retir oceania us unit state expat
319_0;new fuel sourc research
319_1;altern fuel sourc research
319_2;altern fuel sourc research
319_3;ongo research new fuel sourc
319_4;studi new fuel sourc compani univers
319_5;new develop use nuclear wast energi sourc studi compani univers
319_6;new advanc burn coal fuel power sourc
319_7;new materi burn fuel power sourc univers compani
319_8;new fuel sourc research
319_9;fuel sourc nuclear research develop invent
320_0;fiber optic link around the globe flag project
320_1;undersea fiber optic cabl fiber optic link around globe flag
320_2;longest undersea fiber optic cabl
320_3;fiber optic flag project contributor leader investor
320_4;fiber flag optic link global worldwid undersea cabl technolog use stakehold
320_5;fiber flag optic link global worldwid problem encount complic
320_6;fiber flag optic link land site telecommun cabl countri link
320_7;fiber flag optic link list countri link node
320_8;fiber flag optic link bandwidth gigabyt per second
320_9;fiber optic cabl undersea undersea technolog problem
321_0;women in polit
321_1;women represent parliament
321_2;femal represent polit
321_3;women represent legislatur
321_4;gender balanc polit
321_5;gender balanc requir polit
321_6;proport women polit countri statist
321_7;women polit countri statist
321_8;women polit represent countri statist
321_9;women represent polit
322_0;intern art trade fraud embezzl
322_1;intern art fraud embezzl
322_2;intern art trade embezzl
322_3;fraud intern art trade jewelri paint sculptur
322_4;embezzl intern art trade jewelri paint sculptur
322_5;theft intern art trade jewelri paint sculptur
322_6;intern art fraud
322_7;intern art scam fraud embezzl
322_8;art trade fraud embezzl buy sell auction fake forgeri
322_9;fraudul trade art work
323_0;plagiar literatur journal
323_1;plagiar fiction journal
323_2;literari plagiar
323_3;plagiar book journal
323_4;plagiaris doctor master honour thesi
323_5;idea stolen taken author without attribut incid literatur
323_6;instanc media outlet stolen work without permiss attribut
323_7;journalist plagiar exampl instanc
323_8;plagiar literatur journal copyright theft copi uneth fraud
323_9;literari plagiar
324_0;argentina britain intern relat
324_1;argentina unit kingdom falkland island
324_2;defin intern relat argentin british
324_3;argentina britain intern relat
324_4;falkland island disput argentina britain relat
324_5;argentina britain contract relat neg relationship
324_6;argentina britain contract relat posit relationship
324_7;argentina falkland island trade exchang
324_8;argentina uk intern relat
324_9;argentina britain uk unit kingdom falkland island diplomaci intern relat
325_0;cult member lifestyl
325_1;cult name member lifestyl
325_2;lifestyl requir cult member
325_3;cult member diet
325_4;cult member cloth
325_5;cult member goal lifestyl requir
325_6;cult goal requir
325_7;cult member daili life
325_8;cult organ member lifestyl
325_9;cult organ member eat dress habit
326_0;ferri sink major disast
326_1;ferri accid death
326_2;ferri sink
326_3;ferri sink 100 live lost death toll
326_4;ferri sink disast fatal death toll
326_5;ferri sink shipwreck high loss life death toll
326_6;ferri sink mani fatal death drown death toll
326_7;reason ferri capsiz sink mani peopl drown death toll
326_8;ferri sink multipl live lost 100
326_9;ferri fatal sink tragedi storm death ship
327_0;human slaveri
327_1;modern human slaveri
327_2;human slaveri
327_3;global slaveri index
327_4;modern human slaveri hot spot
327_5;place human slaveri current practic sweatshop hot spot
327_6;human traffick slaveri sex industri exploit profit hot spot
327_7;human traffick slaveri construct agricultur industri exploit profit hot spot
327_8;human traffick involuntari servitud hot spot
327_9;human slaveri countri 21st centuri
328_0;papal beatif
328_1;beatifi pope
328_2;pope beatif
328_3;vatican abus
328_4;list beatifi peopl pope
328_5;list individu bless pope
328_6;name deed action pope recognit beatifi bless year
328_7;name deed action pope recognit canon bless year
328_8;list pope beatifi
328_9;new saint pope beatif miracl
329_0;air pollut mexico
329_1;reduc air pollut mexico
329_2;mexico citi air pollut reduct
329_3;mexico citi air pollut
329_4;mexico citi pollut
329_5;mexico citi air pollut problem challeng solut
329_6;mexico citi air pollut reduct car automot automobil public transport
329_7;mexico citi air pollut reduct design studi reduc emiss
329_8;mexico citi air pollut encourag public transport
329_9;mexico citi pollut prevent
330_0;iran iraq tie
330_1;iran iraq alli
330_2;iran iraq cooper
330_3;iran iraq militari cooper
330_4;iran iraq cooper border minor trade militari religi
330_5;iran iraq cooper allianc
330_6;socio econom tie iran iraq
330_7;iran iraq collabor
330_8;cooper iran iraq
330_9;econom coalit iran iraq
331_0;world bank critic
331_1;world bank critic
331_2;world bank polici critic
331_3;critic world bank polici activ personnel
331_4;world bank polici unrespons need countri
331_5;world bank polici much red tape
331_6;world bank problem issu critic
331_7;world bank strict polici problem
331_8;world bank critic accus polici polit personnel unhelp bureaucrat
331_9;strict world bank polici
332_0;incom tax evad us
332_1;us incom tax evad investig
332_2;incom tax evad investig north america
332_3;evad unit state incom tax investig
332_4;tax evas unit state expat illeg
332_5;revenu illeg activ avoid tax
332_6;usa unit state us incom tax evas exampl
332_7;incom tax evas case
332_8;incom tax fraud investig
332_9;us unit state us incom tax evas law crimin revenu illeg justic guilti prosecut
333_0;antibiot resist
333_1;antibiot resist bacteria
333_2;antibiot resist bacteria
333_3;bacteria antibiot resist
333_4;antibiot usag agricultur contribut resist
333_5;bacteria win antibiot
333_6;bacteria antibiot reduc effect
333_7;bacteria antibiot effect
333_8;drug resist bacteria antibiot golden staph
333_9;mutant bacteria antibiot
334_0;export control encrypt softwar effect
334_1;encrypt softwar export control pro con
334_2;encrypt softwar export control argument
334_3;export control encrypt softwar
334_4;encrypt backdoor us govern export control
334_5;use export control encrypt unit state us us
334_6;encrypt softwar export control
334_7;export control encrypt softwar public key
334_8;de nsa export control
334_9;crypto war 90
335_0;biolog adopt parent children problem
335_1;biolog parent adopt relationship
335_2;guardianship  litig case studi
335_3;problem solut biolog parent adopt parent
335_4;adopt children tri contact parent rule court
335_5;biolog adopt parent issu
335_6;biolog adopt parent court battl
335_7;adopt biolog parent problem issu tension famili blend natur
335_8;biolog adopt parent relationship
336_0;black bear attack
336_1;black bear attack caus
336_2;calm savag black bear
336_3;hungri black bear
336_4;black bear attack frequenc
336_5;black bear attack caus
336_6;black bear attack
336_7;caus black bear human attack
336_8;black bear attack
336_9;possibl caus black bear attack
337_0;hepat treatment
337_1;viral hepat treatment
337_2;viral hepat research progress
337_3;viral hepat research
337_4;medic procedur treat viral hepat new research studi
337_5;viral hepat progress treatment
337_6;viral hepat research progress treatment
337_7;viral hepat treatment vaccin immun third world countri
337_8;viral hepat research
337_9;hepat treatment research
338_0;aspirin risk
338_1;aspirin side effect
338_2;advers effect repeatedli take aspirin
338_3;aspirin advers effect repeat use stori
338_4;repeat use aspirin intestin bleed inflamm ulcer stori
338_5;repeat use aspirin harm stori
338_6;aspirin repeat reaction
338_7;aspirin problem daili frequent overus bleed inflamm ulcer advers effect
338_8;repeat use aspirin effect
338_9;frequent consumpt aspirin
339_0;alzheim diseas treatment
339_1;alzheim diseas medicin
339_2;alzheim diseas drug treatment
339_3;alzheim treatment success stori
339_4;drug alzheim diseas success rate
339_5;pharmaceut compani treat alzheim diseas success
339_6;medicin alzheim diseas drug improv success
339_7;alzheim diseas drug success treatment
339_8;alzheim diseas dementia drug treatment success rate prognosi delay onset sever
340_0;land mine elimin problem
340_1;land mine remov icbl treati
340_2;problem elimin land mine use
340_3;elimin use landmin problem
340_4;icbl intern campaign ban landmin treati elimin product transfer use land mine
340_5;prevent landmin icbl treati
340_6;land mine landmin reduct ban
340_7;landmin ban icbl kill maim land mine clearanc remov ampute leg foot
341_0;new secur intern flight
341_1;new secur intern flight luggag passeng
341_2;secur intern flight luggag passeng screen
341_3;increas secur flight
341_4;increas screen flight
341_5;new secur flight
341_6;addit secur intern flight
341_7;luggag screen flight
341_8;luggag screen fli
341_9;fli safeti screen
342_0;diplomat statu sensit inform
342_1;diplomat trade secret theft
342_2;diplomat espionag
342_3;diplomat access sensit classifi trade technolog inform
342_4;diplomat access highli classifi industri project
342_5;diplomat abus posit power sensit highli classifi inform
342_6;diplomat trade secret spi diplomat
342_7;diplomat statu theft illeg econom deport technolog classifi industri
343_0;polic kill
343_1;policeman death murder
343_2;policeman casualti
343_3;civilian polic offic kill duti
343_4;ex past polic offic kill associ
343_5;civilian polic offic kill keep testifi
343_6;civilian polic offic death kill
343_7;polic death duti crimin trial wit silenc payback assassin kill die
344_0;wast time on email
344_1;email overload
344_2;email ineffici
344_3;email time sink
344_4;email abus
344_5;email misus
344_6;social email
344_7;privat email use work
344_8;email abus excess cost system owner
344_9;organ email user abus
345_0;tobacco sale outsid us
345_1;us tobacco compani oversea sale
345_2;us tobacco sale oversea market health find
345_3;us tobacco sale oversea health econom factor
345_4;intern tobacco sale health studi caus effect
345_5;north america oversea tobacco product sale report
345_6;sale tobacco product unit state
345_7;market strategi unit state tobacco compani
345_8;health issu unit state tobacco sale
345_9;unit state tobacco intern sale health
346_0;educ standard around the world
346_1;intern educ standard pre teen
346_2;pre teen educ standard
346_3;unit state us educ standard pre teen young student
346_4;countri outsid unit state us standard pre teen young student
346_5;nation curriculum educ standard pre teen young student
346_6;educ standard primari level countri
346_7;educ minimum standard pre teen children curriculum learn superior better
346_8;countri standard primari student pupil
347_0;effort to prevent extinct
347_1;prevent wildlif extinct
347_2;protect speci
347_3;prevent extinct wildlif outsid us
347_4;prevent extinct wildlif intern
347_5;endang nativ speci prevent
347_6;worldwid wildlif extinct preserv
347_7;wildlif extinct prevent europ
347_8;wildlif extinct prevent australia
347_9;endang nativ speci protect
348_0;agoraphobia incid
348_1;agoraphobia
348_2;agoraphobia
348_3;agoraphobia preval
348_4;fear open public place common underreport
348_5;agoraphobia profess occup stori
348_6;cope manag agoraphobia
348_7;agoraphobia percent occurr
348_8;agoraphobia incid preval common deal cope
348_9;agoraphobia widespread
349_0;metabol chemic reaction produc energi
349_1;catabol anabol reaction glycolysi kreb cycl metabol rate
349_2;metabol
349_3;chemic reaction keep live cell healthi
349_4;catabol anabol reaction metabol process
349_5;glycolysi atp energi
349_6;live cell chemic reaction energi product
349_7;chemic reaction live cell metabol glycolysi kreb cycl disord
349_8;mitochondria
349_9;adenosin triphosph
350_0;daili comput use risk
350_1;comput use problem
350_2;comput physic problem
350_3;comput carpal tunnel cataract fatigu
350_4;comput carpal tunnel
350_5;health hazard daili comput use
350_6;comput termin health hazard
350_7;physic problem caus daili use comput termin
350_8;eye strain fatigu caus use comput termin
350_9;health risk sit front comput daili
351_0;petroleum explor falkland island south atlant
351_1;petroleum explor south atlant falkland island
351_2;falkland petroleum explor
351_3;petroleum explor falkland island
351_4;petroleum search south atlant near falkland island
351_5;petroleum search south atlant near falkland island argentina tension
351_6;petroleum explor south atlant falkland
351_7;oil ga petrol petroleum explor south atlant falkland island discoveri resourc
352_0;chunnel channel tunnel impact british
352_1;british chunnel
352_2;impact chunnel british economi
352_3;chunnel british economi
352_4;britain econom impact tunnel franc chunnel
352_5;britain lifestyl chang tunnel franc chunnel
352_6;chunnel channel tunnel impact uk economi
352_7;chunnel channel tunnel benefit britain lifestyl contin franc
353_0;antarctica scientif explor
353_1;antarctica scientif explor current
353_2;antarctica scientif explor plan
353_3;antarct expedit futur
353_4;scientif investig systemat explor antarctica
353_5;histori antarct explor scientif investig
353_6;plan research activ antarctica
353_7;scientif experi antarctica
353_8;scientif studi perform antarctica
353_9;antarctica scientif explor
354_0;journalist at risk
354_1;journalist kill arrest hostag
354_2;journalist hostag arrest kill
354_3;list journalist kill
354_4;journalist kill action
354_5;journalist hostag situat
354_6;journalist risk war zone
354_7;journalist kill action
354_8;journalist kill work
354_9;journalist endang work
355_0;spaceborn ocean remot sens
355_1;oceanographi space
355_2;spaceborn ocean remot sens applic oceanographi
355_3;spaceborn ocean remot sens
355_4;satellit remot sens oceanographi
355_5;remot sens seab prospect
355_6;marin scienc remot sens
355_7;ocean remot sens satellit develop
355_8;ocean remot sens space seab prospect
355_9;ocean remot sens space mine studi
356_0;use of estrogen postmenopaus women britain
356_1;use oestrogen postmenopaus women britain
356_2;estrogen use postmenopaus women
356_3;hormon replac therapi uk
356_4;estrogen therapi postmenopaus women unit kingdom
356_5;estrogen therapi postmenopaus women britain
356_6;estrogen suppress drug unit kingdom
356_7;estrogen postmenopaus women britain
356_8;estrogen postmenopaus women uk
356_9;estrogen postmenopaus women unit kingdom
357_0;intern boundari disput intern convent on the law of the sea
357_1;intern convent law sea boundari disput
357_2;intern boundari disput
357_3;intern convent law sea
357_4;intern boundari disput 200 mile special econom zone intern convent law sea
357_5;intern boundari disput 12 mile territori water intern convent law sea
357_6;intern boundari border disput 12 mile territori water 200 mile special econom zone
357_7;boundari marin resourc 200 mile econom zone territori water convent
358_0;car accid blood alcohol level
358_1;drunk drive fatal blood alcohol level
358_2;blood alcohol level correl traffic accid
358_3;blood alcohol level car fatal
358_4;automobil accid blood alcohol level bac driver
358_5;automobil accid blood alcohol level likelihood probabl crash
358_6;bac blood alcohol level content car fatal rate
358_7;drink drive bac fatal
358_8;intox influenc blood alcohol excess death fatal crash accid manslaught alcohol booz
359_0;mutual fund perform predictor
359_1;mutual fund perform predictor
359_2;mutual fund perform predictor
359_3;mutual fund perform metric
359_4;mutual fund perform reliabl indic futur perform
359_5;mutual fund perform reliabl indic
359_6;mutual fund perform predict reliabl
359_7;predictor mutual fund perform lead trail outperform invest manag aggress
360_0;drug legal benefit
360_1;drug legal benefit
360_2;drug legal
360_3;drug legal posit
360_4;drug legal reduct overdos inject center
360_5;drug legal drug user avoid contact violent drug dealer
360_6;drug legal puriti drug regul avoid harm impur
360_7;drug legal result declin use addict given support treatment public health issu
360_8;drug legal benefit posit
360_9;drug legal benefit crime reduct
361_0;cloth sweatshop
361_1;cloth sweatshop
361_2;cloth sweatshop
361_3;cloth sweatshop
361_4;cloth sweatshop work condit salari countri
361_5;cloth sweatshop trade global asia africa
361_6;sweatshop cloth
361_7;cloth sweatshop sweat shop design label ethic underpaid underag
362_0;human smuggl incid
362_1;monetari gain human smuggl
362_2;monetari gain human smuggl larg group
362_3;human smuggl
362_4;human traffick
362_5;human smuggl traffick incid
362_6;human smuggl oper
362_7;human smuggl oper econom structur
362_8;human traffick incid smuggler money
362_9;human traffick caught econom gain
363_0;transport tunnel disast
363_1;tunnel disast train car automobil
363_2;transport tunnel disast
363_3;train tunnel disast
363_4;motorway tunnel disast
363_5;train passeng tunnel accid
363_6;tunnel construct disast
363_7;tunnel train collaps transport link
363_8;tunnel disast kill worker transport
363_9;tunnel natur disast threaten live travel
364_0;rabi case
364_1;human rabi
364_2;rabi
364_3;rabi confirm
364_4;rabi contain strategi confirm
364_5;rabi correct measur control spread diseas
364_6;rabi exampl confirm prevent
364_7;rabi attack bite incid recoveri treatment rabid anim
365_0;el nino effect
365_1;el nino effect
365_2;el nino
365_3;el nino effect
365_4;el nino effect flood
365_5;el nino effect drought
365_6;el nino effect global warm climat chang
365_7;el nino impact
365_8;el nino weather warm storm rain wind temperatur ocean flood drought
366_0;cyanid industri commerci use
366_1;cyanid commerci industri applic
366_2;cyanid
366_3;industri commerci cyanid
366_4;cyanid rich wast industri
366_5;toxic cyanid need industri
366_6;cyanid industri commerci use
366_7;cyanid use industri gold mine
367_0;piraci
367_1;boat piraci
367_2;boat piraci
367_3;modern instanc piraci
367_4;piraci incid near africa
367_5;pirat take board ship
367_6;intern piraci report
367_7;ship taken modern pirat
367_8;pirat take ship recent time
367_9;pirat board ship piraci worldwid 2000
368_0;in vitro fertil
368_1;vitro fertil
368_2;vitro fertil
368_3;ivf
368_4;vitro fertil
368_5;vitro fertil sperm egg artifici environ
368_6;vitro fertil freez egg sperm embryo
368_7;vitro fertil ivf explain
368_8;vitro vitro sperm egg ova frozen artifici embryo fertil
369_0;anorexia nervosa bulimia
369_1;anorexia nervosa bulimia caus treatment
369_2;anorexia nervosa bulimia
369_3;anorexia nervosa bulimia caus
369_4;anorexia nervosa bulimia treatment
369_5;anorexia nervosa bulimia caus lax self induc vomit excess exercis
369_6;anorexia bulimia eat disord caus treatment
369_7;caus treatment anorexia nervosa bulimia vomit lax exercis weight ill
370_0;law qualiti process food beverag drug
370_1;food beverag drug process law
370_2;food process
370_3;food beverag drug qualiti safeti
370_4;fda usa food beverag drug
370_5;law qualiti control usa fda us addit preserv
370_6;law qualiti control usa fda us impur poison substanc
370_7;law qualiti control usa fda us spoilag prevent
370_8;law qualiti control usa fda us nutrit enrich
370_9;law qualiti control usa fda us grade meat veget
371_0;health insur coverag holist non tradit medicin treatment
