666_8;margaret thatcher unit state america uk unit kingdom relationship relat impact
667_0;increas unmarri partner household us
667_1;unmarri household us
667_2;unmarri partner household unit state
667_3;sex household unit state
667_4;increas trend unmarri partner household
667_5;increas trend sex partner household
667_6;increas trend sex partner household law legal issu
667_7;increas trend sex partner household child adopt legal issu custodi ivf vitro fertil
667_8;increas trend unmarri lifestyl marriag outdat religi concept
667_9;unmarri partner household america trend usa
668_0;relationship poverti diseas
668_1;poverti diseas connect
668_2;relat poverti diseas
668_3;poverti health care issu
668_4;poverti diseas relationship
668_5;poverti healthcar relationship
668_6;poverti diseas healthcar relationship
668_7;poverti diseas correl
669_0;islam revolut relat us
669_1;islam revolut reason
669_2;relat islam nation unit state
669_3;islam revolut unit state
669_4;islam revolut caus us unit state relat
669_5;deterior islam nation relationship unit state us
669_6;deterior islam nation relationship unit state us consequ wrongdo
669_7;deterior islam nation relationship unit state us extrem imperi
669_8;deterior islam nation relationship unit state us oil explor
669_9;islam revolut caus unit state america usa us
670_0;us elect apathi low turnout
670_1;us elect apathi
670_2;unit state elect turnout
670_3;apathi us unit state us elect polit
670_4;poor voter turnout unit state us elect polit
670_5;apathi unit state us poll booth inaccess hard get
670_6;apathi unit state us democraci polit parti
670_7;apathi unit state us democraci polit parti represent
670_8;apathi unit state us democraci jade politician hypocrit liar corrupt thiev
670_9;apathi unit state us democraci jade corrupt lobbyist lobbi
671_0;salvat armi benefit
671_1;salvat armi help
671_2;salvat armi work achiev
671_3;benefit salvat armi provid poverti homeless
671_4;benefit salvat armi provid soup kitchen food
671_5;benefit salvat armi provid shelter domest violenc safeti secur
671_6;salvat armi benefit provid
671_7;salvat armi homeless needi poverti assist aid help
672_0;nation rifl associ nra membership profil
672_1;membership profil nation rifl associ
672_2;nation rifl associ member profil
672_3;nra member profil
672_4;nation rifl associ age race person
672_5;nation rifl associ person profil
672_6;nation rifl associ polit represent view person
672_7;nra nation rifl associ member detail
672_8;membership profil nation rifl associ nra demograph
673_0;withdraw soviet troop afghanistan
673_1;withdraw soviet union afghanistan
673_2;withdraw ussr afghanistan
673_3;soviet russia withdraw troop afghanistan
673_4;withdraw soviet union troop soldier afghanistan
673_5;factor lead withdraw soviet union soldier troop afghanistan
673_6;withdraw soviet union troop soldier afghanistan reconcili
673_7;soviet withdraw afghanistan reason
674_0;greenpeac prosecut arrest
674_1;greenpeac arrest
674_2;greenpeac member arrest
674_3;greenpeac member prosecut
674_4;greenpeac prosecut member affili
674_5;greenpeac arrest member prosecut individu organ
674_6;greenpeac member crimin record
674_7;greenpeac prosecut member
675_0;train olymp swim meet
675_1;olymp swim train
675_2;olymp swim meet train
675_3;olymp swim meet train requir
675_4;olymp swim train
675_5;train condit site requir olymp swim prepar
675_6;train condit temperatur exercis olymp swim prepar
675_7;olymp swim train condit requir
676_0;poppi cultiv export worldwid
676_1;poppi cultiv export
676_2;poppi cultiv export report
676_3;cultiv poppi export morphin heroin opiat illeg narcot
676_4;cultiv poppi export morphin heroin opiat illeg narcot worldwid distribut network crimin
676_5;cultiv poppi export morphin heroin opiat illeg narcot histori develop earli day
676_6;poppi cultiv export
676_7;poppi cultiv export industri illeg
677_0;lean tower of pisa stabil
677_1;lean tower pisa restor
677_2;effort stabil learn tower pisa
677_3;lean tower pisa current statu
677_4;reinforc stabil lean tower pisa
677_5;stabil lean tower pisa
677_6;fix lean lean tower pisa
677_7;current state lean tower pisa
677_8;reinforc lean tower pisa
677_9;lean tower pisa structur sound
678_0;joint share custodi impact on children
678_1;share custodi divorc children pro con
678_2;joint custodi impact children
678_3;share custodi impact children
678_4;share custodi impact child
678_5;econom effect share custodi child
678_6;social effect share custodi child
678_7;emot effect share custodi child
678_8;share custodi child impact
679_0;us open seal adopt record
679_1;us debat seal adopt court record
679_2;open seal adopt record court order
679_3;seal adopt record adopte debat unit state us court sanction
679_4;interest birth parent adopte debat unit state us court sanction
679_5;access adopt record adopte debat unit state us court sanction
679_6;open adopt record adopte debat unit state us court sanction
679_7;usa unit state america debat seal adopt record
680_0;spanish in us school improv live of mexican immigr
680_1;spanish us educ improv mexican immigr
680_2;mexican immigr spanish speak school unit state
680_3;spanish unit state us school mexican immigr
680_4;spanish languag unit state us mexican immigr improv qualiti life student
680_5;spanish languag unit state us mexican immigr improv qualiti life famili
680_6;mexican spanish american school
680_7;spanish speaker nativ mexican immigr school mother tongu
681_0;wind power instal locat
681_1;wind power locat
681_2;locat wind power station
681_3;wind power instal locat
681_4;wind turbin instal locat
681_5;wind farm instal worldwid
681_6;wind farm locat
681_7;wind farm locat site ridg ocean
682_0;teach english to immigr
682_1;english educ adult immigr
682_2;immigr english learn program adult
682_3;english teach adult immigr pedagogi
682_4;english teach adult immigr program inform session
682_5;english teach adult recent immigr immigr
682_6;adult immigr english languag teach program
682_7;teach english recent migrant
683_0;break up czechoslovakia social polit impact
683_1;break czechoslovakia czech republ slovakia
683_2;czechoslovakia break
683_3;czech republ slovakia break
683_4;czechoslovakia czech republ slovakia break polit impact
683_5;czechoslovakia czech republ slovakia break social emot impact
683_6;czechoslovakia czech republ slovakia split impact
683_7;czech republ slovakia czechoslovakia impact social polit
684_0;medic benefit for part time worker
684_1;part time work provid medic benefit
684_2;health care benefit part time worker
684_3;busi govern medic benefit part time worker
684_4;medic benefit part time worker oversea parliament govern
684_5;medic benefit part time worker oversea busi compani organ
684_6;part time worker medic  benefit busi
684_7;medic health benefit part time fraction casual worker employe
685_0;oscar winner vote process
685_1;oscar winner select
685_2;academi award nomin select criteria
685_3;oscar award nomin select criteria
685_4;oscar winner award select nomin process
685_5;vote oscar award democrat
685_6;number amount elig voter oscar award
685_7;oscar winner select process
685_8;oscar academi award select vote choic winner
686_0;neg impact argentina peg peso to dollar
686_1;argentin peso us dollar problem
686_2;problem issu peg argentina peso us dollar
686_3;argentina peg peso us unit state us dollar neg effect
686_4;argentina peg peso us unit state us dollar reason econom slump downturn recess
686_5;argentina peg peso us unit state us dollar neg effect fix exchang rate
686_6;argentina peso usd us dollar peg problem
686_7;pro con advantag disadvantag argentinian currenc peso fix peg us unit state dollar
687_0;northern ireland economi industri busi
687_1;northern ireland busi industri
687_2;major industri northern ireland
687_3;economi northern ireland industri busi
687_4;macroeconom activ northern ireland industri busi
687_5;northern ireland major import export gdp gross domest product economi
687_6;northern ireland economi industri
687_7;industri economi northern ireland major employ
688_0;media bia outsid us
688_1;intern media bia
688_2;intern media bia
688_3;media bia europ
688_4;media bia australia
688_5;media bia asian countri
688_6;media bia canada
688_7;media bia britain
688_8;bia exist media worldwid outsid unit state us
688_9;alleg bia exist media worldwid outsid unit state us
689_0;usaid famili plan support
689_1;usaid famili plan
689_2;countri receiv aid famili plan unit state
689_3;unit state deni aid famili plan
689_4;limit famili plan support unit state
689_5;unit state us global financi aid recipi famili plan countri
689_6;unit state us global financi aid recipi famili plan countri refus limit support
689_7;unit state us global financi aid recipi pregnanc countri refus limit support
689_8;unit state us global financi aid recipi pregnanc countri
689_9;us usa unit state famili plan support
690_0;colleg graduat increas incom
690_1;univers graduat increas incom
690_2;hire potenti colleg graduat
690_3;us colleg educ improv job opportun
690_4;graduat hire potenti north america
690_5;colleg educ improv job seek
690_6;advantag colleg educ unit state
690_7;advantag colleg educ job opportun
690_8;increas hire potenti univers graduat
690_9;increas hire potenti master increas job opportun univers graduat
691_0;clear cut object
691_1;clear cut forest protest
691_2;object clear cut forest
691_3;argument clear cut forest
691_4;clear cut clear cut old forest object
691_5;clear cut clear cut old forest debat resist
691_6;clear cut clearcut controversi environ activ
691_7;clear cut forestri log object
691_8;forest clear cut disadvantag protest protest resist timber tree log
692_0;prostat cancer detect treatment
692_1;prostat cancer detect treatment
692_2;prostat cancer gener treatment
692_3;prostat cancer earli detect
692_4;prostat cancer detect
692_5;prostat cancer treatment avail
692_6;prostat cancer treatment differ stage develop
692_7;prostat cancer detect treatment
693_0;electron media newspap industri
693_1;effect electron media newspap
693_2;impact electron media newspap industri
693_3;electron media newspap industri print dead
693_4;internet destroy print industri newspap media dead
693_5;read news onlin instead print destroy newspap industri
693_6;newspap industri declin electron technolog media
693_7;electron media newspap print advertis industri readership declin circul
694_0;how to make a compost pile
694_1;compost
694_2;make compost pile
694_3;procedur make compost pile
694_4;compost pile construct
694_5;dimens compost pile
694_6;size compost pile
694_7;depth compost pile
694_8;add compost pile fruit veget egg teabag
694_9;compost pile
695_0;white collar crime sentenc durat
695_1;white collar crime averag sentenc
695_2;length sentenc white collar crime
695_3;white collar crime sentenc legal
695_4;judg bia white collar crime sentenc legal
695_5;white collar crime fraud sentenc
695_6;white collar crime sentenc
695_7;white collar crime sentenc
696_0;cosmet plastic surgeri hazard risk safeti
696_1;cosmet plastic surgeri safeti
696_2;cosmet plastic surgeri safeti concern
696_3;risk plastic surgeri
696_4;safeti cosmet plastic surgeri
696_5;heart condit cosmet plastic surgeri safeti issu
696_6;health safeti enhanc bodi plastic surgeri
696_7;plastic surgeri cosmet safeti
696_8;hazard cosmet plastic surgeri
696_9;safeti cosmet plastic surgeri
697_0;work condit us air traffic control
697_1;us air traffic control work condit
697_2;work condit salari level unit state air traffic control
697_3;air traffic control pay scale unit state
697_4;work condit unit state us air traffic control
697_5;pay incom unit state us air traffic control
697_6;break shift hour work unit state us air traffic control
697_7;usa us unit state air traffic control work condit salari
697_8;pay condit air traffic control us unit state
697_9;american control air traffic work condit
698_0;literaci rate african countri
698_1;african literaci rate
698_2;literaci rate africa
698_3;literaci rate africa
698_4;literaci rate sudan
698_5;literaci rate south africa
698_6;african countri literaci rate list
698_7;literaci rate africa
699_0;term limit pro con
699_1;term limit pro con
699_2;pro con term limit
699_3;term limit legisl studi
699_4;debat term limit legisl pro con posit neg govern
699_5;term limit legisl opinion critic govern
699_6;term limit great improv posit unit state us govern
699_7;term limit pro con
699_8;term limit valu advantag
699_9;term limit valu disadvantag
700_0;increas gasolin tax us
700_1;gasolin tax pro con
700_2;gasolin tax unit state
700_3;gasolin tax increas us unit state posit neg
700_4;gasolin tax hike increas critic debat unit state us
700_5;gasolin tax hike posit improv great wonder unit state us
700_6;us usa unit state gasolin tax increas argument reason
700_7;pro con advantag disadvantag cost benefit gasolin tax increas us unit state
700_8;gasolin tax survey
