601_0;turkey river control iraq water resourc
601_1;turkish river control project iraqi
601_2;turkish river control project iraq water resourc
601_3;water resourc issu turkey iraq
601_4;turkish river control project iraq water resourc
601_5;river control issu turkey iraq
601_6;turkish river border control project iraq water resourc transboundari cooper
601_7;turkish river control project iraq water sourc impact
602_0;separ czech republ slovak republ czechoslovakia
602_1;czechoslovakia establish sovereign countri czech slovak
602_2;czech slovakia process separ
602_3;czech slovakia break
602_4;czech slovak republ separ sovereign countri process
602_5;czechoslovakia czech slovak republ separ process
602_6;czechoslovakia czech slovak republ dissolut
602_7;czech slovak czechoslovakia separ process
603_0;us lawsuit against tobacco industri
603_1;us lawsuit tobacco industri
603_2;unit state lawsuit tobacco industri cigarett health problem
603_3;unit state lawsuit tobacco industri death cigarett smoke
603_4;us unit state lawsuit tobacco health problem smoke
603_5;us unit state lawsuit tobacco health problem nicotin spike
603_6;usa us unit state lawsuit tobacco industri health problem death
603_7;cigarett tobacco lobbi litig health cancer alleg lawsuit juri trial outcom settlement
604_0;lyme diseas arthriti
604_1;lyme diseas arthriti
604_2;tick born lyme diseas arthriti
604_3;lyme diseas arthriti link
604_4;lyme diseas inflammatori joint disord arthriti
604_5;lyme arthriti evid studi infect
604_6;arthriti lyme diseas link
604_7;arthriti tick lyme diseas scientif inflammatori joint disord pain pain
605_0;univers health care uk pro con
605_1;uk univers health care system
605_2;great britain univers health care system
605_3;england univers health care system
605_4;pro con unit kingdom health care system
605_5;britain univers health care system pro con
605_6;britain univers health care system critic
605_7;britain univers health care system recommend
605_8;uk univers health pro con posit neg
606_0;ban leg trap
606_1;anim trap ban
606_2;ban leg trap
606_3;ban steel jaw trap
606_4;leg trap captur anim ban prohibit
606_5;steel jaw trap captur anim ban prohibit
606_6;steel jaw trap captur anim ban prohibit sale fur market
606_7;anim leg trap ban
607_0;human genet code map mileston
607_1;human genom map mileston
607_2;human genom project mileston
607_3;human genom sequenc map achiev
607_4;human genom sequenc import mileston
607_5;map human genom studi import key mileston breakthrough
607_6;map human genom studi achiev mileston timelin
607_7;map sequenc human genom mileston
608_0;us social secur benefit tax pro con
608_1;tax us social secur benefit
608_2;pro con unit state social secur benefit incom tax
608_3;social secur benefit tax us unit state debat
608_4;us unit state social secur tax debat
608_5;us unit state social secur tax debat deficit reduct
608_6;usa unit state us social secur tax pro con
608_7;pro con advantag disadvantag tax us unit state welfar benefit
609_0;per capita alcohol consumpt by countri state provinc
609_1;intern alcohol consumpt comparison
609_2;per capita alcohol consumpt across european countri
609_3;per capita alcohol consumpt unit state
609_4;per capita alcohol consumpt australia
609_5;per capita alcohol consumpt asian countri
609_6;per capita person consumpt alcohol worldwid
609_7;per capita person consumpt alcohol countri
609_8;per capita person consumpt alcohol state
609_9;per capita person consumpt alcohol provinc
610_0;us small busi neg impact rais minimum wage
610_1;problem rais minimum wage busi
610_2;impact unit state rais minimum wage
610_3;rais minimum wage neg effect busi unit state us
610_4;increas minimum wage hurt small busi unit state us
610_5;reason small busi oppos increas minimum wage us unit state
610_6;neg impact minimum wage increas usa unit state small busi
610_7;impact effect us unit state small busi minimum wage increas oppos object
611_0;violent kurd germani
611_1;violenc kurd germani
611_2;kurd violent activ germani pkk worker parti kurdistan
611_3;pkk kurd violenc germani
611_4;destruct activ perpetr kurd worker part kurdistan pkk germani
611_5;terrorist activ perpetr kurd worker part kurdistan pkk germani
611_6;violent activ perpetr kurd worker part kurdistan pkk germani
611_7;burn arson activ perpetr kurd worker part kurdistan pkk germani
611_8;riot activ perpetr kurd worker part kurdistan pkk germani
611_9;kurd pkk violenc germani
612_0;pro independ protest tibet arrest by chines
612_1;tibet independ protest
612_2;tibet independ protest arrest china
612_3;independ protest tibet arrest china happen
612_4;legal sentenc pro independ protest tibet
612_5;anti chines anti chines pro independ pro independ protest tibet
612_6;releas freedom pro independ protest tibet
612_7;treatment pro independ protest tibet
612_8;tibet arrest chines independ protest outcom
613_0;dispos of berlin wall
613_1;berlin wall dispos
613_2;dismantl dispos berlin wall piec brick
613_3;berlin wall piec souvenir
613_4;berlin wall piec monument
613_5;berlin wall dispos remov
613_6;dispos piec berlin wall museum
613_7;dispos piec berlin wall piec souvenir
613_8;dispos piec berlin wall monument
613_9;berlin wall souvenir dispos
614_0;flavr savr
614_1;flavr savr tomato calgen
614_2;genet modifi flavor saver
614_3;flavr savr tomato calgen
614_4;flavr savr tomato calgen
614_5;genet modifi food flavr savr tomato
614_6;flavr savr inform calgen genet modifi
614_7;flavor saver inform calgen genet modifi
614_8;flavor saver inform calgen genet modifi tomato
614_9;flavr savr inform calgen genet modifi tomato
615_0;us raw timber export asia
615_1;us timber export asia
615_2;unit state raw timber export asia lumber industri
615_3;environment issu timber export asia unit state
615_4;raw timber export asia unit state us
615_5;econom concern export raw timber asia unit state us
615_6;environment concern export raw timber asia unit state us
615_7;usa unit state us raw timber export asia impact
616_0;volkswagen product mexico
616_1;volkswagen product mexico
616_2;volkswagen mexico product histori
616_3;volkswagen product mexico
616_4;volkswagen product mexico histori
616_5;amount volkswagen automobil car automot vehicl produc mexico
616_6;mexico volkswagen product histori
616_7;volkswagen product mexico manufactur automot histori number car
617_0;cuban economi reduc russian support
617_1;reduct russian support cuban economi effect
617_2;reduct russian support cuban economi
617_3;russian less reduc support cuban economi
617_4;russian less reduc support cuban economi assist relat
617_5;cuba soviet union relat reduc support econom declin
617_6;russian support reduct cuba econom impact
617_7;russian support cuban economi aid reduc affect effect
618_0;iran ayatollah khomeini death ramif
618_1;presid ayatollah khomeini death iran effect
618_2;death iranian presid ayatollah khomeini
618_3;iranian presid ayatollah khomeini death
618_4;iran presid ayatollah khomeini ramif aftermath death
618_5;iran presid ayatollah khomeini successor
618_6;ayatollah khomeini death impact ramif implic
618_7;iranian presid ayatollah khomeini death consequ follow
619_0;winni mandela kidnap south africa 1988
619_1;winni mandela kidnap scandal
619_2;winni mandela murder scandal
619_3;winni mandela scandal decemb 1988 januari 1989
619_4;winni mandela kidnap scandal south africa
619_5;winni mandela kidnap
619_6;winni mandela role kidnap murder
619_7;winni mandela person involv kidnap
619_8;winni mandela person involv kidnap charg convict scandal
619_9;winni mandela kidnap scandal south africa
620_0;south pacif nuclear test protest franc
620_1;french protest nuclear test
620_2;french respons south pacif nuclear test protest
620_3;franc respond protest nuclear test south pacif
620_4;french govern respons nuclear test protest
620_5;franc respons protest nuclear test south pacif
620_6;franc respons protest nuclear test
620_7;condemn french nuclear test respons
620_8;french repli protest nuclear test
620_9;franc nuclear test protest media confer
621_0;women ordain priest uk
621_1;church england women ordain priest
621_2;great britain women ordain church england priest
621_3;britain approv women ordain church england priest
621_4;britain approv women ordain church england priest vote church offici
621_5;britain approv women ordain church england priest vote british parliament
621_6;uk approv woman ordain priest
621_7;women priest great britain uk unit kingdom england church ordain femal synod parliament
622_0;price fix compani corpor indict
622_1;price fix accus
622_2;corpor price fix scandal
622_3;price fix compani corpor
622_4;compani corpor accus indict price fix product
622_5;compani corpor accus indict price fix dram ram random access memori
622_6;lysin price fix conspiraci accus indict price fix
622_7;aluminium metal price fix conspiraci accus indict price fix
622_8;music cd compact disc price fix conspiraci accus indict price fix
622_9;price fix compani exampl
623_0;ricin sarin soman anthrax weapon
623_1;ricin sarin soman anthrax chemic weapon
623_2;ricin sarin soman anthrax biomed weapon
623_3;toxic chemic weapon
623_4;toxic chemic weapon
623_5;anthrax chemic weapon
623_6;ricin chemic weapon
623_7;sarin nerv agent chemic weapon
623_8;soman chemic weapon
623_9;ricin sarin soman anthrax chemic weapon use
624_0;strateg defens initi sdi star war pro con
624_1;star war strateg defens initi
624_2;strateg defens initi sdi pro con
624_3;sdi star war unit state defens strategi
624_4;strateg defens initi star war sdi technic detail
624_5;strateg defens initi star war sdi detail industri countri
624_6;strateg defens initi star war sdi detail countri mad nuclear weapon
624_7;strateg defens initi star war sdi detail mutual assur destruct
624_8;strateg defens initi sdi star war develop pro con advantag disadvantag
625_0;world trade center bomber 1993
625_1;world trade center  1993 bomber arrest convict
625_2;arrest convict world trade center wtc bomber
625_3;world trade center februari 1993 bomb arrest convict bomber
625_4;world trade center februari 1993 bomb legal process arrest held custodi
625_5;world trade center februari 1993 bomb legal process arrest held custodi counter terror palestin
625_6;wtc bomber 1993 arrest convict world trade center
625_7;world trade center bomb 1993 arrest convict guilti
626_0;human stamped death
626_1;human stamped multipl death
626_2;list human stamped
626_3;human stamped sport event
626_4;human stamped mani death
626_5;human stamped result mass death toll
626_6;human stamped kill 20 peopl toll
626_7;human stamped huge loss life death toll
626_8;human crush death sport event death toll
626_9;human stamped huge loss life festiv death toll
627_0;postsoviet russia food crisi us support
627_1;usaid food crisi collaps soviet union ussr
627_2;russia food crisi postsoviet unit state support
627_3;us unit state usaid russia soviet union
627_4;food shortag russia soviet union collaps us unit state foreign aid crisi
627_5;food shortag russia soviet union collaps us unit state foreign aid crisi acut poverti
627_6;us unit state usa soviet union food crisi russia
627_7;us unit state russia wheat food soviet union collaps shortag
628_0;justif us invad panama
628_1;us invas panama justif
628_2;unit state govern record panama invas
628_3;us unit state panama invas reason
628_4;unit state panama invas reason justif govern
628_5;us unit state panama invas war drug
628_6;us unit state panama invas money launder
628_7;us unit state panama invas marin kill
628_8;us unit state panama invas 35000 live protect
628_9;usa us unit state govern panama invas reason
629_0;incid of violent attack on abort clinic
629_1;abort clinic act violenc
629_2;abort clinic bomb
629_3;abort clinic arson
629_4;bomb shoot attack abort clinic doctor staff
629_5;violent attack abort clinic
629_6;bomb abort clinic
629_7;arson abort clinic
629_8;doctor staff violent attack abort clinic
629_9;abort clinic attack violent anti protest
630_0;gulf war syndrom symptom
630_1;gulf war syndrom symptom
630_2;symptom gulf war syndrom
630_3;ill gulf war veteran
630_4;symptom desert storm syndrom
630_5;gulf war syndrom symptom
630_6;gulf war syndrom symptom lawsuit
630_7;gulf war syndrom symptom lawsuit desert storm syndrom
630_8;gulf war syndrom ill symptom
630_9;gulf war syndrom ptsd desert storm veteran ill
631_0;nelson mandela elect south africa
631_1;nelson mandela elect presid
631_2;nelson mandela elect presid south africa
631_3;nelson mandela elect presid republ south africa
631_4;nelson mandela elect campaign republ south africa
631_5;nelson mandela elect polici republ south africa
631_6;nelson mandela rsa south africa presid elect
631_7;nelson mandela elect presid south africa
632_0;tin mine asia
632_1;tin mine asia
632_2;tin mine china malaysia indonesia vietnam burma thailand lao
632_3;tin mine countri southeast asia
632_4;tin mine china malaysia indonesia vietnam burma thailand lao
632_5;major tin mine countri southeast asia
632_6;major tin mine countri china
632_7;major tin mine countri malaysia
632_8;major tin mine countri indonesia
632_9;major tin mine countri vietnam
633_0;welsh devolut movement
633_1;welsh devolut movement histori
633_2;welsh devolut movement histor record
633_3;welsh devolut movement
633_4;welsh devolut movement histor fact
633_5;welsh devolut movement caus
633_6;welsh devolut movement histori
633_7;welsh devolut histori
633_8;histori welsh devolut movement wale background
634_0;l tryptophan dietari supplement death
634_1;l tryptophan dietari supplement death
634_2;taint l tryptophan dietari supplement death
634_3;number death taint l tryptophan dietari supplement
634_4;l tryptophan dietari supplement death death toll
634_5;l tryptophan ltryptophan taint fatal death dietari supplement death toll
634_6;l tryptophan em disast 1989 gmo product death count toll
634_7;l tryptophan l tryptophan death taint
635_0;assist suicid us
635_1;doctor assist suicid us
635_2;us euthanasia
635_3;debat argument doctor assist suicid unit state
635_4;doctor assist suicid us unit state debat
635_5;unit state doctor assist suicid euthanasia us unit state debat
635_6;unit state doctor assist suicid euthanasia us unit state doctor opinion
635_7;doctor assist suicid euthanasia unit state usa america
636_0;juri servic exempt
636_1;juri exempt reason
636_2;juri duti exempt
636_3;occup like exempt juri duti
636_4;exempt serv juri reason
636_5;occup exempt worker juri duti
636_6;conflict interest exempt worker juri duti
636_7;juri duti exempt list
637_0;human growth hormon hgh pro con
637_1;human growth hormon adult effect
637_2;pro con human growth hormon hgh adult
637_3;human growth hormon hgh debat adult
637_4;human growth hormon hgh debat contenti adult
637_5;human growth hormon hgh debat adult applic
637_6;hgh human growth hormon adult use
637_7;pro con advantag disadvantag human growth hormon hgh adult
638_0;prison freed faulti forens evid fals testimoni poor polic work
638_1;wrong convict prison freed
638_2;prison wrongli convict due faulti forens evid fals testimoni
638_3;freed pardon polit prison prosecut
638_4;freed prison wrong convict
638_5;incorrect forens evid freed prison discharg wrong convict
638_6;bad polic work freed prison discharg wrong convict
638_7;corrupt polic freed prison discharg wrong convict
638_8;fals testimoni freed prison discharg wrong convict
638_9;wrong convict faulti forens fals testimoni error
639_0;onlin shop growth
639_1;onlin shop growth factor
639_2;onlin shop growth factor statist
639_3;growth internet shop factor
639_4;increas onlin shop statist growth factor reason
639_5;increas onlin shop statist growth factor varieti valu
639_6;increas onlin shop statist growth factor educ technolog literaci
639_7;increas onlin shop statist growth factor mobil phone ownership increas
639_8;growth onlin shop
640_0;govern matern leav polici
640_1;matern leav govern polici
640_2;matern leav polici unit state
640_3;matern leav polici europ
640_4;matern leav polici govern
640_5;matern leav polici govern pass legisl
640_6;matern leav polici govern benefit provid unaccount
640_7;matern leav polici govern
641_0;exxon valdez oil spill marin life wildlif
641_1;exxon valdez oil spill marin life wildlif
641_2;exxon valdez oil spill impact marin life
641_3;exxon valdez oil spill marin wildlif
641_4;exxon valdez oil spill problem issu challeng
641_5;exxon valdez oil spill anim rescu save dead die death
641_6;exxon valdez oil spill impact environ
641_7;exxon valdez disast impact environment damag wildlif marin
642_0;tiananmen squar protest 1989
642_1;tiananmen squar  protest arrest
642_2;tiananmen squar demonstr arrest beij 1989
642_3;tiananmen squar protest arrest beij 1989
642_4;tiananmen squar protest happen
642_5;tiananmen squar protest arrest aftermath outcom
642_6;tiananmen squar protest arrest legal process charg imprison fine
642_7;tiananmen squar arrest
643_0;power dam salmon fisheri
643_1;dam harm salmon fisheri us pacif northwest
643_2;impact power dam pacif northwest salmon fisheri
643_3;impact dam salmon popul unit state pacif northwest
643_4;power dam pacif northwest salmon fisheri harm unit state
643_5;power dam pacif neg impact salmon popul us unit state
643_6;power dam pacif neg impact salmon popul us unit state environment issu
643_7;pacif northwest north west power dam salmon harm
644_0;exot anim import us uk
644_1;exot speci import us uk britain
644_2;bird exot anim import unit state
644_3;bird exot anim import unit kingdom
644_4;exot speci anim import britain us
644_5;import rare bird britain uk unit state us
644_6;import rare anim britain uk unit state us
644_7;unit state america usa us unit kingdom uk exot anim import
645_0;softwar piraci impact
645_1;softwar piraci financi impact
645_2;financi impact softwar piraci industri
645_3;financi impact video music piraci industri
645_4;financi impact softwar piraci
645_5;softwar piraci cost busi annual
645_6;net loss incur piraci pirat softwar compani statist
645_7;softwar piraci financi impact
645_8;softwar piraci cost impact econom intellectu properti
646_0;food stamp benefit increas
646_1;food stamp recipi increas
646_2;rate food stamp benefit
646_3;increas number food stamp recipi
646_4;food stamp polici
646_5;food stamp elig increas
646_6;food stamp elig peopl
646_7;food stamp elig immigr
646_8;food stamp increas depend race
646_9;food stamp increas depend gender
647_0;windmil electr product cost
647_1;wind power electr econom
647_2;windmil gener electr econom product
647_3;cost electr gener windmil
647_4;wind turbin electr product
647_5;windmil technolog gener electr cost benefit analysi
647_6;wind farm econom product gener electr
647_7;windmil electr gener econom viabl product
648_0;famili leav law
648_1;famili leav law
648_2;famili medic leav act qualif
648_3;famili leav law qualif
648_4;famili leav law compens long
648_5;famili leav law compens time durat reason health condit
648_6;famili leav law compens time durat reason medic certif
648_7;famili leav law exampl time compens
649_0;comput viru infect
649_1;comput virus
649_2;comput viru infect strategi
649_3;comput viru transmiss spread
649_4;comput viru outdat old insecur softwar exploit mail worm
649_5;comput viru trust execut attach email
649_6;comput viru boot sector transmiss remov media
649_7;comput viru code execut buffer overflow
649_8;comput viru infect
650_0;seriou tax evas us uk
650_1;larg scale tax evas indict
650_2;tax evas unit state unit kingdom two million dollar
650_3;individu corpor charg tax evas two million dollar britain us
650_4;corpor avoid tax us uk unit state unit kingdom britain fraud
650_5;corpor avoid tax us uk unit state unit kingdom britain fraud money lost
650_6;usa us unit state america unit kingdom uk tax evas corpor
650_7;tax evas us uk england britain million dollar larg scale massiv fraud unit state
651_0;chang in ethnic composit us popul
651_1;us popul ethnic
651_2;unit state popul shift ethnic group make
651_3;us unit state popul demograph race ethnic
651_4;us unit state popul race ethnic genet makeup breed interraci
651_5;us unit state popul demograph race divers increas
651_6;usa unit state ethnic shift america
651_7;ethnic makeup us unit state popul latino black caucasian
652_0;oic balkan 1990
652_1;organ islam cooper oic balkan island
652_2;oic balkan region
652_3;oic involv balkan 1990 1994
652_4;oic balkan nation group posit debat deliber involv
652_5;organis islam confer oic balkan 1990 1994
652_6;oic balkan 1990 1991 1992 1993 1994 1990 1994
652_7;oic involv balkan
653_0;eta activ basqu spain
653_1;eta basqu terrorist organ
653_2;eta basqu terrorist spain
653_3;eta basqu terrorist organ spain
653_4;eta basqu activ spain illeg
653_5;eta basqu leftist movement separatist group
653_6;eta basqu terrorist spain activ
653_7;eta basqu terrorist separatist fighter spain civil
654_0;same sex school advantag disadvantag
654_1;sex school pro con
654_2;sex school pro con
654_3;sex school advantag disadvantag
654_4;sex school advantag disadvantag
654_5;benefit advantag debat girl school girl
654_6;benefit advantag debat boy school boy
654_7;social issu girl attend girl school
654_8;social issu boy attend boy school
654_9;sex school pro con advantag disadvantag
655_0;attent deficit disord children diagnosi treatment
655_1;attent deficit disord add diagnosi treatment
655_2;attent deficit disord diagnosi young children
655_3;adhd diagnosi treatment young children
655_4;add attent deficit disord diagnosi young children
655_5;add attent deficit disord symptom earli warn sign young children
655_6;add attent deficit disord treatment young children
655_7;add attent deficit disord adhd treatment diagnosi
656_0;lead poison paint water pipe children
656_1;child protect lead poison paint water pipe
656_2;paint water pipe poison protect children
656_3;paint water pipe poison lawsuit
656_4;young children lead poison protect paint water pipe
656_5;young children lead poison protect paint water pipe legal issu lawsuit law suit
656_6;young children lead poison abat reduct project
656_7;child lead poison pipe paint protect prevent
657_0;prayer ban us school
657_1;us school prayer ban
657_2;prayer ban unit state school
657_3;prayer religion us unit state public school ban
657_4;prayer religion us unit state christian privat school allow
657_5;prayer religion us unit state public school allow
657_6;us unit state america prayer pray school ban
657_7;prayer ban us unit state school court rule
658_0;teenag pregnanc us
658_1;us teenag pregnanc
658_2;birth rate teenag mother
658_3;caus result teenag pregnanc
658_4;teenag pregnanc reduct
658_5;teenag abort
658_6;teenag pregnanc unit state
658_7;teenag abort unit state
658_8;teenag pregnanc unit state us
658_9;birth rate teenag mother unit state us
659_0;cruis ship health safeti mainten standard
659_1;cruis ship health safeti mainten
659_2;cruis ship safeti mainten standard guidelin
659_3;cruis ship health safeti mainten
659_4;recreat cruis ship health safeti practic
659_5;recreat cruis ship health safeti resort manag practic
659_6;cruis ship liner health safeti standard
659_7;health safeti passeng cruis ship ill accid boat marin sea ocean
660_0;whale watch california
660_1;whale watch california coast
660_2;whale watch site california
660_3;whale watch guid servic california
660_4;whale watch coast california
660_5;whale watch coast california guid servic watch whale
660_6;watch coast california guid servic locat book time
660_7;california whale watch
661_0;melanoma caus treatment
661_1;melanoma treatment caus diagnosi
661_2;caus treatment melanoma
661_3;research caus diagnosi melanoma
661_4;melanoma skin cancer treatment
661_5;melanoma skin cancer caus reason
661_6;melanoma skin cancer sun protect
661_7;melanoma caus treatment prognosi
662_0;protect against telemarket
662_1;telemarket legisl regul strategi protect consum
662_2;legisl regul telemarket scam
662_3;telemarket consum protect unwant interrupt
662_4;telemarket spam filter consum strategi
662_5;telemarket legisl protect consum regul
662_6;telemarket consum protect scam
662_7;telemarket scam protect legisl regul
662_8;telemarket legisl call scam
663_0;agent orang health effect
663_1;agent orang health vietnam veteran
663_2;vietnam veteran unit state agent orang
663_3;health effect agent orang vietnam veteran unit state us studi
663_4;health effect agent orang vietnam veteran unit state us studi medic journal research medicin
663_5;health effect agent orang vietnam veteran unit state us studi univers public
663_6;agent orang us unit state veteran impact health issu
663_7;health effect danger ill long term agent orang vietnam veteran va affair
664_0;nation museum of the american indian
664_1;nation museum american indian
664_2;nation museum american indian locat
664_3;collect nation museum american indian
664_4;nation museum american indian locat
664_5;nation museum american indian collect art piec work cultur
664_6;nation museum american indian similar museum exhibit
664_7;nation museum american indian collect locat
665_0;poverti extent sub saharan africa
665_1;sub saharan africa poverti
665_2;poverti sub saharan africa
665_3;sub saharan africa poverti rampant widespread
665_4;sub saharan africa poverti extens
665_5;sub saharan africa poverti decreas improv
665_6;sub saharan africa poverti increas get wors
665_7;sub saharan poverti condit africa
665_8;poverti sub saharan africa fact figur dollar per day subsist
666_0;margaret thatcher resign us uk relat
666_1;margaret thatcher resign impact us uk relat
666_2;margaret thatcher resign impact us british relat
666_3;prime minist margaret thatcher resign unit state relat
666_4;prime minist thatcher resign unit state relat
666_5;prime minist margaret thatcher resign us uk relat
666_6;prime minist margaret thatcher resign us uk relat histor event
666_7;prime minist margaret thatcher resign us uk relat neg
