371_1;health insur coverag acupunctur non tradit medicin treatment
371_2;health insur coverag
371_3;health insur non tradit medicin
371_4;health insur coverag unproven medic treatment acupunctur
371_5;health insur coverag natur therapi
371_6;health insur cover altern medicin
371_7;health insur coverag altern medicin therapi prevent well
372_0;nativ american casino gambl
372_1;nativ american casino gambl social implic
372_2;nativ american casino gambl growth
372_3;socio econom impact nativ american casino
372_4;growth indian tribe casino
372_5;tribe casino gambl
372_6;nativ american casino gambl
372_7;nativ american casino gambl
372_8;nativ american casino gambl social implic
372_9;nativ american casino gambl effect economi
373_0;us export encrypt concern
373_1;export concern encrypt hardwar
373_2;encrypt equip export concern
373_3;unit state encrypt export concern commerci exploit
373_4;unit state us encrypt export commerci exploit
373_5;unit state us encrypt break cipher counter intellig anti crime
373_6;unit state us hack weak encrypt counter intellig anti crime
373_7;usa unit state export encrypt equip devic
374_0;nobel prize winner
374_1;nobel prize winner biographi
374_2;list nobel prize winner
374_3;background nobel prize winner
374_4;nobel prize field studi name year
374_5;nobel prize winner year award field studi earli career
374_6;nobel prize winner year award field studi motiv work
374_7;nobel prize winner list
375_0;hydrogen energi sourc
375_1;hydrogen energi sourc
375_2;research hydrogen fuel
375_3;hydrogen fusion fuel research
375_4;hydrogen energi research statu
375_5;hydrogen energi control fusion
375_6;hydrogen energi power engin
375_7;hydrogen energi safeti feasibl
375_8;hydrogen energi sourc car
375_9;hydrogen energi power transport
376_0;intern court of justic case
376_1;world court intern court justic case type
376_2;intern court justic mandat
376_3;intern court justic case type
376_4;intern court justic case studi
376_5;intern court justic case
376_6;world court intern court justic case
376_7;world court intern court justic case war tribun
376_8;world court intern court justic icj case
377_0;cigar smoke popular
377_1;renew interest cigar smoke
377_2;cigar smoke
377_3;cigar smoke popular rise
377_4;cigar smoke popular increas econom social issu
377_5;cigar smoke popular increas cigar night cigar room
377_6;cigar smoke popular increas actor smoke cigar movi product
377_7;cigar smoke popular spike
378_0;euro opposit
378_1;euro currenc dislik
378_2;euroscept
378_3;euro currenc opposit
378_4;euro opposit
378_5;opposit use euro
378_6;currenc polici use euro
378_7;opposit european currenc
378_8;countri oppos euro
378_9;countri like euro reason
379_0;mainstream impair children
379_1;mainstream children physic mental impair
379_2;mainstream handicap children
379_3;children impair school support
379_4;mainstream children physic mental impair
379_5;mainstream children pro con
379_6;educ studi mainstream impair children
379_7;place disabl children normal school
379_8;place mental impair student normal school
379_9;mental disabl student public school
380_0;obes medic treatment
380_1;medic treatment obes
380_2;obes treatment
380_3;medic treatment obes
380_4;treatment obes prescrib medic
380_5;treatment obes treatment tummi tuck posit effect
380_6;obes treatment medic
380_7;obes morbid treatment manag side effect danger
381_0;altern medicin success
381_1;altern medicin effect
381_2;altern medicin treatment success
381_3;altern medicin
381_4;altern medicin ill diseas success rate
381_5;altern medicin treatment diseas success rate
381_6;altern medicin treatment cancer psycholog stress
381_7;altern medicin success
382_0;hydrogen car
382_1;hydrogen fuel piston driven automobil hydrogen fuel cell
382_2;hydrogen fuel
382_3;hydrogen fuel piston car safeti
382_4;hydrogen fuel safe storag vehicl car
382_5;hydrogen fuel cell gener electr drive car
382_6;hydrogen fuel car
382_7;hydrogen automot engin safeti fuel cell car energi futur
383_0;mental ill drug
383_1;mental ill medicin
383_2;mental ill medic
383_3;mental ill treatment drug
383_4;mental ill drug
383_5;drug use treat depress
383_6;drug use treat anxieti
383_7;drug use treat schizophrenia
383_8;drug use treat psychosi
383_9;drug use treat ptsd post traumat stress disord
384_0;space station moon colon
384_1;space station moon colon
384_2;colon moon
384_3;space station colon moon
384_4;plan colon moon
384_5;reason moon colon delay
384_6;plan stage underway colon moon
384_7;countri commit resourc establish moon base
384_8;moon coloni space base
385_0;hybrid car engin
385_1;hybrid automobil
385_2;hybrid car
385_3;hybrid car
385_4;hybrid car engin
385_5;current statu hybrid automot automobil car engin
385_6;current statu hybrid automot automobil car methanol engin
385_7;current statu hybrid automot automobil car alcohol engin
385_8;current statu hybrid automot automobil car hydrogen engin
385_9;current statu hybrid automot automobil car engin cost consum
386_0;teach disabl children
386_1;tool teach disabl children
386_2;current special need method
386_3;new method teach disabl children
386_4;teach disabl children new pedagogi methodolog
386_5;teach mental challeng children new pedagogi methodolog
386_6;teach physic disabl children new pedagogi methodolog
386_7;disabl children teach method
387_0;radioact wast handl
387_1;effect handl radioact wast
387_2;radioact wast
387_3;radioact wast safe handl
387_4;radioact wast safe handl inciner
387_5;radioact wast safe handl cement
387_6;radioact wast safe handl bitumen
387_7;radioact wast safe handl vitrif
387_8;radioact wast safe handl underground nuclear explos
387_9;radioact wast manag techniqu
388_0;organ fertil
388_1;organ fertil
388_2;organ fertil
388_3;organ safe fertil soil enhanc
388_4;compost sludg organ fertil safe soil enhanc
388_5;soil enhanc organ safe fertil
388_6;ash veget wast organ fertil safe soil enhanc
388_7;microorgan organ fertil safe soil enhanc
388_8;compost soil enhanc organ fertil
389_0;illeg technolog transfer
389_1;illeg technolog transfer intern
389_2;technolog espionag
389_3;accus illeg technolog transfer
389_4;illeg transfer militari technolog weapon
389_5;illeg hostil document sold oversea
389_6;illeg technolog sold compani oversea
389_7;illeg technolog sold oversea
389_8;illeg product sold oversea govern
389_9;illeg formula sold oversea person
390_0;orphan drug
390_1;orphan drug act
390_2;orphan drug
390_3;orphan drug peopl
390_4;drug treat diseas affect peopl orphan drug
390_5;orphan drug act orphan diseas condit
390_6;orphan drug act orphan diseas condit handl countri outsid us
390_7;orphan drug issu
391_0;rd price of drug
391_1;research develop drug cost
391_2;drug price research
391_3;research develop price drug
391_4;research develop pharmaceut aspect affect cost
391_5;research develop pharmaceut cost make drug
391_6;research develop pharmaceut cost produc drug scale
391_7;drug price r research develop
392_0;robot applic
392_1;current applic robot
392_2;robot
392_3;robot applic current
392_4;robot applic use automot automobil car industri
392_5;robot applic use construct industri
392_6;robot applic use food industri
392_7;robot applic use hospit industri
392_8;robot applic use everi home
392_9;robot applic use
393_0;merci kill
393_1;euthanasia
393_2;merci kill
393_3;merci kill
393_4;merci kill legal statu
393_5;merci kill europ
393_6;merci kill unit state
393_7;merci kill australia
393_8;merci kill discuss
393_9;merci kill argument
394_0;homeschool
394_1;educ home
394_2;home school qualiti educ
394_3;homeschool
394_4;homeschool methodolog
394_5;home school program report success
394_6;social aspect homeschool
394_7;home school children
394_8;homeschool outcom
394_9;educ child home
395_0;attract tourism to boost economi
395_1;attract tourism improv local economi
395_2;tourism success stori
395_3;attract tourism
395_4;tourist trap improv local economi
395_5;tourism attempt improv local economi
395_6;increas tourism economi boost
395_7;tourism boost enhanc polici increas visitor year year
396_0;sick build syndrom
396_1;build relat ill
396_2;sick build syndrom
396_3;asbesto
396_4;sick build syndrom
396_5;sick build syndrom
396_6;build relat ill
396_7;air condit sick
396_8;pollut control insid build
396_9;sick build syndrom asbesto
397_0;automobil recal
397_1;automobil recal reason
397_2;automobil recal
397_3;car manufactur recal
397_4;car compani recal
397_5;major incid behind car vehicl recal
397_6;car recal
397_7;automobil recal
397_8;car recal manufactur
397_9;car recal compani
398_0;european convent arm cut dismantl europ arsen
398_1;european convent arm cut
398_2;european convent arm cut
398_3;reduc forc europ cfe european convent arm cut
398_4;number weapon reduc european convent arm cut
398_5;number soldier retrench european convent arm cut
398_6;number reduct made warsaw pact european convent arm cut
398_7;number reduct made nato european convent arm cut
398_8;european convent arm cut warsaw pact nato
399_0;oceanograph vessel
399_1;oceanograph vessel activ equip
399_2;oceanographi boat ship vessel equip activ
399_3;oceanograph vessel
399_4;oceanograph vessel sea map
399_5;equip use oceanograph vessel
399_6;survey ship oceanograph research
399_7;drone ocean undersea map
399_8;unman deep sea robot explor
399_9;drone oceanograph vessel monitor
400_0;amazon rainforest preserv
400_1;amazon rainforest preserv south american author
400_2;amazon rainforest preserv measur
400_3;amazon conserv
400_4;amazon rainforest preserv local organ
400_5;brazil govern effort preserv amazon rainforest
400_6;preserv amazon tropic rainforest
400_7;preserv amazon tropic rainforest author organ
400_8;preserv amazon tropic rainforest offici institut
400_9;preserv amazon tropic rainforest govern polici
401_0;integr foreign minor germani
401_1;foreign minor germani integr issu
401_2;germani foreign minor integr
401_3;languag cultur differ immigr germani
401_4;foreign minor germani cultur languag issu
401_5;foreign minor germani immigr difficulti caus reason
401_6;foreign minor germani immigr difficulti integr
401_7;languag cultur foreign minor germani
402_0;behavior genet impact behavior person
402_1;behavior genet human person
402_2;behavior genet
402_3;genet environment factor behavior studi person
402_4;behavior genet research behavior person
402_5;behavior genet substanc abus
402_6;behavior genet detect disposit toward addict behavior
402_7;behavior genet genet disord add attent deficit disord
402_8;behaviour genet research
403_0;osteoporosi diet potassium magnesium fruit veget bone miner densiti
403_1;osteoporosi
403_2;effect dietari intak potassium magnesium fruit veget determin bone miner densiti elderli men women thu prevent osteoporosi bone decay
403_3;osteoporosi
403_4;dietari intak potassium osteoporosi prevent
403_5;potassium magnesium fruit veget bone miner densiti osteoporosi
403_6;fruit veget prevent osteoporosi elderli
403_7;diet nutrit prevent osteoporosi
403_8;osteoporosi prevent potassium magnesium bone miner densiti
404_0;ireland peac talk
404_1;ireland peac talk delay
404_2;ireland peac talk disrupt
404_3;ireland peac talk delay violenc bomb
404_4;northern ireland peac talk delay
404_5;peac talk disrupt ireland
404_6;ireland peach talk interrupt
404_7;peac talk delay ireland violenc
404_8;peac talk delay ireland violent act
404_9;number time peac talk delay ireland due violenc
405_0;unexpect cosmic event radiat supernova outburst new comet
405_1;unexpect cosmic event
405_2;unexpect unexplain cosmic event celesti phenomena radiat supernova outburst new comet
405_3;cosmic event
405_4;celesti phenomena
405_5;celesti phenomena detect radiat supernova outburst comet
405_6;unexpect unexplain cosmic event radiat supernova
405_7;cosmic event detect unexplain bewild bemus phenomena
405_8;supernova observ unexplain unexpect
405_9;unexplain cosmic celesti event
406_0;parkinson diseas treatment
406_1;parkinson diseas
406_2;parkinson treatment
406_3;parkinson diseas treatment drug
406_4;parkinson diseas treatment
406_5;manag onset develop parkinson diseas
406_6;studi drug program patient care parkinson diseas success rate
406_7;parkinson diseas treatement
406_8;parkinson diseas treatment
406_9;parkinson qualiti life
407_0;poach wildlif preserv impact
407_1;poach wildlif preserv effect
407_2;poach impact wildlif preserv
407_3;impact poach wildlif reserv
407_4;poach wildlif preserv
407_5;impact poach preserv
407_6;impact poach preserv save eleph
407_7;impact poach preserv save turtl
407_8;wildlif poach impact
407_9;preserv wildlif poach affect
408_0;tropic storm
408_1;tropic storm hurrican typhoon properti damag life loss
408_2;tropic storm hurrican typhoon damag death
408_3;effect tropic cyclon
408_4;damag caus hurrican
408_5;damag caus typhoon
408_6;tropic storm hurrican properti damag
408_7;tropic storm typhoon properti damag
408_8;tropic storm hurrican death
408_9;tropic storm typhoon death
409_0;legal action pan am 103 lockerbi 1988
409_1;pan flight 103 legal
409_2;lockerbi legal action
409_3;legal action destruct pan flight 103
409_4;destruct pan flight scotland 1988
409_5;pan flight 103 lockerbi scotland legal action
409_6;pan flight 103 lockerbi scotland legal charg claim
409_7;pan flight 103 lockerbi scotland legal fine impos
409_8;pan flight 103 scotland legal
409_9;legal pan flight 103
410_0;schengen agreement border control
410_1;schengen agreement
410_2;schengen agreement
410_3;schengen agreement western europ border control visa insur
410_4;schengen agreement signatur
410_5;schengen border control countri involv
410_6;schengen border control aspir
410_7;schengen agreement reason
411_0;shipwreck salvag
411_1;shipwreck treasur
411_2;shipwreck
411_3;shipwreck salvag sunken ship treasur discoveri
411_4;shipwreck salvag recoveri treasur sunken ship
411_5;dive salvag treasur ship
411_6;maritim finder keeper ship salvag treasur shipwreck
411_7;shipwreck salvag treasur recoveri
412_0;airport secur
412_1;airport secur
412_2;airport measur
412_3;airport secur measur guidelin regul
412_4;airport secur measur place
412_5;airport secur measur propos airport
412_6;airport secur measur propos airport caus tragedi
412_7;airport secur measur propos airport effect secur
412_8;airport secur measur propos airport train staff
412_9;secur measur airport
413_0;new steel product method
413_1;steel product methodolog
413_2;new steel product method
413_3;new steel product method
413_4;mini mill steel product
413_5;produc steel new method
413_6;new method produc steel minimil blast furnac method entrepreneur compani
413_7;new method produc steel minimil blast furnac method success failur problem solut critic
413_8;steel product method mini mill
414_0;cuba sugar export
414_1;cuba sugar export partner
414_2;cuba sugar export
414_3;sugar import cuba
414_4;cuba sugar export quantiti
414_5;import cuban sugar
414_6;cuban sugar import
414_7;cuba sugar industri export per year
414_8;cuban export sugar industri
414_9;much sugar cuba export
415_0;drug traffick golden triangl
415_1;golden triangl drug traffick
415_2;drug traffick
415_3;golden triangl drug traffick
415_4;drug traffick burma thailand lao golden triangl
415_5;drug issu golden triangl
415_6;drug traffick golden triangl burma thailand lao
415_7;drug traffick intern organis crime group golden triangl
415_8;drug traffick intern organis crime group golden triangl california hawaii
415_9;golden triangl drug traffick
416_0;three gorg project
416_1;three gorg project statu
416_2;three gorg project complet
416_3;three gorg project statu
416_4;statu three gorg project
416_5;statu three gorg project
416_6;progress report three gorg project
416_7;three gorg project complet statu
416_8;three gorg project complet date
416_9;three gorg project setback
417_0;measur creativ
417_1;measur creativ
417_2;measur creativ
417_3;creativ character measur
417_4;creativ measur metric
417_5;measur creativ person test psycholog assess
417_6;measur creativ guilford measur
417_7;creativ measur
418_0;quilt gener incom
418_1;quilt incom
418_2;quilt
418_3;quilt product book class servic
418_4;incom quilt
418_5;quilt gener incom quilt class book lesson
418_6;quilt gener incom object quilt
418_7;quilt gener incom museum quilt
418_8;quilt gener incom fundrais
418_9;incom quilt
419_0;car tire recycl
419_1;car tyre recycl
419_2;automobil tire recycl
419_3;old automobil tire recycl
419_4;use recycl tire
419_5;recycl tire road construct
419_6;new method car tire recycl
419_7;car tire recycl scrap rubber
419_8;automobil tire recycl scrap rubber
419_9;automobil tire recycl reef build
420_0;carbon monoxid poison global
420_1;intern carbon monoxid poison
420_2;carbon monoxid poison
420_3;carbon monoxid poison symptom caus prevent
420_4;carbon monoxid poison statist
420_5;carbon monoxid poison global
420_6;carbon monoxid poison symptom caus prevent global
420_7;carbon monoxid poison symptom global faulti heater
420_8;carbon monoxid poison rate worldwid
421_0;dispos industri wast
421_1;intern industri wast manag
421_2;industri wast dispos
421_3;industri wast dispos storag
421_4;hazard industri wast manag storag
421_5;industri wast dispos manag
421_6;industri wast manag hazard
421_7;industri wast manag servic
421_8;industri wast dispos method
422_0;stolen art
422_1;forg art
422_2;art theft forgeri
422_3;art forgeri scandal
422_4;art theft scandal
422_5;stolen art piec
422_6;incid forg artwork
422_7;art theft report
422_8;stolen one kind art
422_9;stolen art museum
423_0;mirjana markov
423_1;mirjana markov slobodan milosev
423_2;mirjana markov
423_3;mira markov
423_4;milosev markov wife
423_5;serbian presid wife mirjana markov
423_6;milosev  wife mirjana markov
423_7;mirjana markov
423_8;serbian presid wife mira
423_9;presid milosev wife mirjana markov mira
424_0;alleg suicid murder
424_1;alleg suicid murder
424_2;suspici suicid
424_3;disguis murder crime suicid
424_4;alleg suicid actual murder
424_5;victim suicid murder
424_6;alleg suicid actual murder secret sinist plot
424_7;murder disguis suicid
425_0;money counterfeit
425_1;currenc counterfeit
425_2;counterfeit
425_3;counterfeit currenc incid
425_4;counterfeit money modern time
425_5;fake money modern era method product
425_6;fake money use 21st centuri instanc use
425_7;modern money currenc counterfeit
426_0;polic dog
426_1;law enforc dog
426_2;polic dog train
426_3;polic dog handler
426_4;polic dog
426_5;dog use law enforc
426_6;polic dog
426_7;law enforc dog
426_8;polic dog train oper
426_9;drug snif dog train oper
427_0;uv damag eye
427_1;uv light harm eye
427_2;uv damag eyesight
427_3;uv damag eye
427_4;eye problem caus excess exposur sunlight
427_5;uv light caus eye problem
427_6;cataract ocular melanoma caus sunlight
427_7;uv damag vision
427_8;uv damag human eye
427_9;ultraviolet damag human eye
428_0;countri with declin birth rate
428_1;countri declin birth rate
428_2;birth rate
428_3;declin birth rate europ
428_4;declin birth rate asia
428_5;declin birth rate develop countri
428_6;countri declin birth rate africa
428_7;countri declin birth rate europ
428_8;countri declin birth rate oceania
428_9;countri declin birthrat
429_0;legionnair diseas outbreak
429_1;legionnair diseas outbreak
429_2;legionnair outbreak
429_3;legionnair diseas outbreak
429_4;legionnair diseas outbreak locat
429_5;legionnair diseas outbreak build air condit locat
429_6;legionnair diseas outbreak worldwid
429_7;legionnair diseas outbreak
429_8;legionnair diseas outbreak case
430_0;african killer bee human attack
430_1;african killer bee attack human
430_2;african bee human attack
430_3;killer bee human attack incid
430_4;killer bee attack human
430_5;african killer bee attack human
430_6;killer bee loss human life
430_7;killer bee unsaf save victim
430_8;african killer bee attack
431_0;robot technolog develop
431_1;robot latest develop
431_2;robot
431_3;new develop robot technolog
431_4;recent advanc robot technolog
431_5;robot technolog develop
431_6;latest develop robot technolog
431_7;robot technolog recent trend develop
431_8;robot develop applic
432_0;polic profil of motorist
432_1;polic profil traffic stop
432_2;motorist profil
432_3;polic profil motorist
432_4;polic stop motorist race age sex gender
432_5;polic profil stop car race
432_6;polic profil stop car age
432_7;polic profil stop car sex gender
432_8;polic profil stop car suburb
432_9;polic profil stop car locat
433_0;stoicism interest
433_1;contemporari stoicism
433_2;modern day stoicism
433_3;list greek philosophi stoicism
433_4;greek stoicism philosophi
433_5;contemporari interest stoicism
433_6;play greek stoicism philosophi
433_7;product greek stoicism sage
433_8;product greek stoicism philosoph
433_9;stoicism modern age contemporari art
434_0;estonia economi
434_1;estonia economi
434_2;estonia economi
434_3;economi perform issu estonia
434_4;estonia economi statist
434_5;estonia union treati
434_6;estonia monetari perform
434_7;estonia economi
435_0;curb popul growth
435_1;popul control
435_2;reduc popul growth
435_3;popul control measur
435_4;countri enforc birth control polici
435_5;effect popul growth control
435_6;reduc popul growth strategi
435_7;studi reduc popul growth
435_8;stunt popul growth intervent
435_9;success attempt reduc popul growth
436_0;railway accid caus
436_1;train accid caus
436_2;train accid
436_3;train crash caus
436_4;world rail accid
436_5;caus railway accid
436_6;famou railway accid
436_7;railway accid worldwid caus
436_8;tram accid worldwid caus
436_9;trolley accid worldwid caus
437_0;deregul ga electr impact custom
437_1;ga electr util compani deregul
437_2;deregul ga electr
437_3;deregul ga electr util residenti custom
437_4;deregul ga electr util price residenti price
437_5;cost live increas deregul util ga electr
437_6;cost live increas deregul util ga electr household pressur
437_7;ga electr deregul implic result
438_0;countri with increas in tourism
438_1;increas tourism countri
438_2;list countri boom tourism
438_3;increas tourism europ
438_4;increas tourism asia
438_5;increas tourism australia
438_6;increas tourism unit state
438_7;countri experienc tourism increas
438_8;countri surg tourist countri
438_9;nation experienc tourist tourism travel backpack
439_0;scientif discoveri 1990
439_1;post 1990 scientif invent discoveri
439_2;new scientif discoveri
439_3;new recent scientif discoveri
439_4;recent advanc scienc
439_5;new scientif invent
439_6;recent scientif invent
439_7;recent scientif invent patent
439_8;new scientif invent patent pend
439_9;new scientif invent 1990
440_0;elimin child labor
440_1;child labor prevent
440_2;child labor
440_3;govern regul abus child labor
440_4;child labor abus govern corpor
440_5;child labor govern intervent
440_6;child labor govern intervent worldwid
440_7;child abus labor labour prevent govern corpor ngo
441_0;lyme diseas treatment prevent
441_1;lyme diseas prevent
441_2;lyme diseas prevent
441_3;lyme diseas treatment
441_4;lyme diseas prevent treatment
441_5;lyme diseas treatment
441_6;prevent lyme diseas
441_7;lyme diseas insect spray
441_8;lyme diseas prevent treatment
442_0;selfless heroic act
442_1;altruist act
442_2;heroism
442_3;selfless heroic act
442_4;heroic act
442_5;heroic act explan
442_6;selfless act benefit other
442_7;altruist act small group
442_8;altruist act small organis
442_9;altruist act individu
443_0;us invest sub saharan africa
443_1;us invest africa
443_2;north america assist sub saharan africa
443_3;unit state invest sub saharan africa
443_4;sub saharan african unit state invest
443_5;sub saharan african us invest
443_6;tanzania unit state invest
443_7;angola unit state invest
443_8;sudan unit state invest
443_9;kenya unit state invest
444_0;supercrit fluid environment protect measur
444_1;supercrit fluid environment protect measur
444_2;supercrit fluid use
444_3;supercrit fluid pressur environment protect
444_4;supercrit fluid environment protect
444_5;pressur produc supercrit fluid environment protect
444_6;supercrit fluid scf epa
444_7;supercrit fluid environ protect
445_0;femal clergi
445_1;women clergi
445_2;women pastor
445_3;women clergi europ australia asia south america
445_4;women clergi
445_5;countri women clergi
445_6;women church pastor europ
445_7;women church pastor australia
445_8;women church pastor worldwid
445_9;women approv priest oversea
446_0;countri where tourist suffer bodili harm or death
446_1;violenc tourist
446_2;tourist death bodili harm
446_3;tourist like violent attack countri
446_4;like violent attack travel countri
446_5;countri like physic harm tourist
446_6;tourist violenc harm death danger locat
446_7;tourist danger attack mug theft violenc risk danger spot
447_0;stirl engin
447_1;stirl engin stirl cycl applic develop
447_2;applic stirl engin stirl cycl
447_3;develop stirl engin
447_4;stirl cycl develop
447_5;develop stirl engin futur environment friendli sustain
447_6;stirl engin develop applic cycl
447_7;stirl cycl engin develop applic innov
448_0;ship loss weather
448_1;shipwreck weather
448_2;ship loss caus tropic storm hurrican typhoon cyclon
448_3;weather loss ship sea
448_4;weather reason shipwreck vessel intern water
448_5;weather reason shipwreck vessel coastal water
448_6;weather caus ship loss sea
448_7;weather caus loss ship sink storm wave
449_0;antibiot ineffect
449_1;antibiot resist
449_2;caus resist antibiot
449_3;caus ineffect antibiot infect
449_4;new drug test antibiot effect
449_5;ineffect antibiot infect caus
449_6;agricultur caus ineffect antibiot
449_7;farm anim fed antibiot caus ineffect
449_8;antibiot effect new drug
450_0;jordan king hussein middl east peac
450_1;jordan king hussein peac
450_2;jordan king hussein peac middl east
450_3;jordanian king hussein peac middl east
450_4;jordanian king hussein israel effort peac process
450_5;jordanian king hussein israel jordan peac treati
450_6;jordan king hussein peac middl east israel
450_7;king hussein jordan middl east peac process broker israel assist summit
